{
  "contractVersion": "1.0",
  "packId": "spiders",
  "name": "Spiders and creepy-crawlies",
  "version": "1.0.0",
  "description": "Hides spiders and similar crawling animals, including cartoons. Measured on the spiders-eval-v1 test set: recall 0.93, clean false-cover rate 0.01.",
  "sensitive": false,
  "concepts": [
    {
      "contractVersion": "1.0",
      "conceptId": "spiders",
      "displayName": "Spiders",
      "layer": 2,
      "enabled": true,
      "looksLike": [
        "a photo of a spider",
        "a tarantula",
        "a spider web with a spider"
      ],
      "butNot": [
        "a spider-man costume",
        "a crab",
        "a spider plant"
      ],
      "keywords": [
        "spider",
        "tarantula"
      ],
      "scope": "wholeElement",
      "coverStyle": "mosaic",
      "showLabel": true
    },
    {
      "contractVersion": "1.0",
      "conceptId": "centipedes",
      "displayName": "Centipedes",
      "layer": 2,
      "enabled": true,
      "looksLike": [
        "a centipede",
        "a millipede"
      ],
      "butNot": [
        "a caterpillar"
      ],
      "scope": "object",
      "coverStyle": "solid",
      "showLabel": false
    }
  ],
  "accuracy": {
    "recall": 0.93,
    "cleanFalseCoverRate": 0.01,
    "testImages": 120,
    "testSet": "spiders-eval-v1"
  },
  "licence": "CC-BY-4.0"
}
